{
  "title": "user_song",
  "source": "file",
  "duration": 391.488,
  "key": {
    "name": "F major",
    "tonic": "F",
    "mode": "major",
    "confidence": 0.896
  },
  "tempo": 112.3,
  "rhythm": {
    "tempo": 112.3,
    "meter": 4,
    "confidence": 0.694,
    "beat_times": [
      0.836,
      1.416,
      1.904,
      2.438,
      2.972,
      3.506,
      4.04,
      4.574,
      5.085,
      5.596,
      6.13,
      6.664,
      7.198,
      7.709,
      8.243,
      8.777,
      9.311,
      9.822,
      10.333,
      10.867,
      11.378,
      11.889,
      12.399,
      12.934,
      13.468,
      13.978,
      14.512,
      15.047,
      15.581,
      16.091,
      16.625,
      17.136,
      17.67,
      18.181,
      18.692,
      19.226,
      19.76,
      20.294,
      20.782,
      21.293,
      21.85,
      22.407,
      22.941,
      23.452,
      23.986,
      24.543,
      25.031,
      25.565,
      26.099,
      26.61,
      27.167,
      27.678,
      28.166,
      28.746,
      29.257,
      29.791,
      30.325,
      30.836,
      31.393,
      31.904,
      32.438,
      32.949,
      33.483,
      33.994,
      34.505,
      35.039,
      35.573,
      36.084,
      36.595,
      37.152,
      37.663,
      38.174,
      38.684,
      39.219,
      39.753,
      40.287,
      40.797,
      41.332,
      41.842,
      42.353,
      42.887,
      43.421,
      43.955,
      44.489,
      45.0,
      45.534,
      46.068,
      46.602,
      47.113,
      47.647,
      48.181,
      48.692,
      49.25,
      49.784,
      50.318,
      50.828,
      51.339,
      51.85,
      52.384,
      52.918,
      53.429,
      53.963,
      54.497,
      55.031,
      55.565,
      56.076,
      56.61,
      57.121,
      57.655,
      58.189,
      58.7,
      59.211,
      59.722,
      60.233,
      60.767,
      61.301,
      61.835,
      62.369,
      62.88,
      63.414,
      63.948,
      64.459,
      64.993,
      65.503,
      66.038,
      66.572,
      67.082,
      67.617,
      68.127,
      68.685,
      69.242,
      69.753,
      70.287,
      70.798,
      71.308,
      71.843,
      72.353,
      72.864,
      73.375,
      73.909,
      74.443,
      74.954,
      75.488,
      76.022,
      76.556,
      77.067,
      77.601,
      78.135,
      78.646,
      79.18,
      79.737,
      80.271,
      80.805,
      81.293,
      81.804,
      82.338,
      82.895,
      83.406,
      83.94,
      84.451,
      84.985,
      85.496,
      86.007,
      86.541,
      87.075,
      87.586,
      88.12,
      88.654,
      89.165,
      89.699,
      90.21,
      90.744,
      91.278,
      91.788,
      92.323,
      92.88,
      93.414,
      93.901,
      94.436,
      94.97,
      95.504,
      96.015,
      96.525,
      97.059,
      97.593,
      98.128,
      98.638,
      99.172,
      99.683,
      100.217,
      100.751,
      101.285,
      101.796,
      102.33,
      102.841,
      103.375,
      103.886,
      104.397,
      104.908,
      105.442,
      105.976,
      106.51,
      107.044,
      107.578,
      108.112,
      108.623,
      109.134,
      109.668,
      110.179,
      110.713,
      111.247,
      111.758,
      112.268,
      112.803,
      113.313,
      113.847,
      114.381,
      114.916,
      115.45,
      115.984,
      116.518,
      117.052,
      117.563,
      118.073,
      118.608,
      119.118,
      119.652,
      120.186,
      120.721,
      121.255,
      121.789,
      122.3,
      122.834,
      123.344,
      123.878,
      124.413,
      124.923,
      125.434,
      125.968,
      126.479,
      127.036,
      127.547,
      128.081,
      128.592,
      129.126,
      129.66,
      130.171,
      130.705,
      131.239,
      131.75,
      132.261,
      132.772,
      133.306,
      133.863,
      134.374,
      134.885,
      135.419,
      135.93,
      136.44,
      136.975,
      137.509,
      138.066,
      138.577,
      139.111,
      139.645,
      140.156,
      140.713,
      141.224,
      141.758,
      142.269,
      142.803,
      143.337,
      143.871,
      144.405,
      144.916,
      145.427,
      145.961,
      146.495,
      147.006,
      147.54,
      148.05,
      148.561,
      149.095,
      149.606,
      150.117,
      150.651,
      151.162,
      151.696,
      152.207,
      152.764,
      153.298,
      153.832,
      154.366,
      154.877,
      155.411,
      155.945,
      156.479,
      156.99,
      157.524,
      158.035,
      158.569,
      159.08,
      159.591,
      160.125,
      160.636,
      161.146,
      161.681,
      162.191,
      162.725,
      163.26,
      163.77,
      164.304,
      164.838,
      165.373,
      165.907,
      166.441,
      166.951,
      167.486,
      168.02,
      168.554,
      169.088,
      169.599,
      170.133,
      170.643,
      171.178,
      171.712,
      172.222,
      172.756,
      173.291,
      173.825,
      174.335,
      174.869,
      175.404,
      175.938,
      176.472,
      176.982,
      177.517,
      178.027,
      178.538,
      179.049,
      179.583,
      180.117,
      180.628,
      181.162,
      181.696,
      182.207,
      182.718,
      183.229,
      183.786,
      184.32,
      184.854,
      185.365,
      185.899,
      186.433,
      186.944,
      187.478,
      188.012,
      188.523,
      189.057,
      189.568,
      190.102,
      190.636,
      191.17,
      191.704,
      192.238,
      192.749,
      193.283,
      193.817,
      194.351,
      194.862,
      195.373,
      195.884,
      196.394,
      196.928,
      197.486,
      198.043,
      198.577,
      199.088,
      199.599,
      200.133,
      200.644,
      201.154,
      201.665,
      202.176,
      202.687,
      203.198,
      203.732,
      204.289,
      204.8,
      205.357,
      205.868,
      206.402,
      206.913,
      207.447,
      207.981,
      208.492,
      209.026,
      209.56,
      210.094,
      210.628,
      211.139,
      211.65,
      212.184,
      212.695,
      213.206,
      213.74,
      214.251,
      214.785,
      215.319,
      215.853,
      216.387,
      216.898,
      217.432,
      217.966,
      218.477,
      218.987,
      219.498,
      220.056,
      220.566,
      221.1,
      221.634,
      222.145,
      222.656,
      223.19,
      223.724,
      224.258,
      224.792,
      225.303,
      225.837,
      226.371,
      226.882,
      227.416,
      227.95,
      228.484,
      228.995,
      229.529,
      230.063,
      230.574,
      231.108,
      231.619,
      232.13,
      232.664,
      233.198,
      233.709,
      234.22,
      234.707,
      235.265,
      235.775,
      236.333,
      236.867,
      237.378,
      237.912,
      238.422,
      238.933,
      239.491,
      240.048,
      240.559,
      241.093,
      241.627,
      242.138,
      242.625,
      243.159,
      243.693,
      244.227,
      244.762,
      245.296,
      245.806,
      246.34,
      246.851,
      247.362,
      247.896,
      248.407,
      248.964,
      249.498,
      250.032,
      250.567,
      251.101,
      251.611,
      252.145,
      252.656,
      253.19,
      253.724,
      254.235,
      254.769,
      255.28,
      255.791,
      256.325,
      256.836,
      257.37,
      257.881,
      258.415,
      258.949,
      259.483,
      259.994,
      260.528,
      261.039,
      261.573,
      262.084,
      262.618,
      263.152,
      263.663,
      264.197,
      264.731,
      265.242,
      265.799,
      266.31,
      266.844,
      267.355,
      267.889,
      268.399,
      268.934,
      269.444,
      270.002,
      270.512,
      271.047,
      271.581,
      272.091,
      272.602,
      273.16,
      273.67,
      274.204,
      274.739,
      275.273,
      275.783,
      276.317,
      276.828,
      277.362,
      277.873,
      278.384,
      278.918,
      279.429,
      279.986,
      280.52,
      281.054,
      281.588,
      282.099,
      282.657,
      283.167,
      283.701,
      284.212,
      284.746,
      285.28,
      285.768,
      286.279,
      286.813,
      287.347,
      287.858,
      288.415,
      288.926,
      289.437,
      289.971,
      290.505,
      291.016,
      291.55,
      292.084,
      292.618,
      293.152,
      293.663,
      294.197,
      294.708,
      295.242,
      295.753,
      296.263,
      296.821,
      297.378,
      297.866,
      298.376,
      298.91,
      299.445,
      299.955,
      300.489,
      301.0,
      301.511,
      302.022,
      302.556,
      303.067,
      303.601,
      304.112,
      304.646,
      305.18,
      305.714,
      306.225,
      306.736,
      307.27,
      307.804,
      308.315,
      308.849,
      309.383,
      309.917,
      310.451,
      310.962,
      311.496,
      312.03,
      312.541,
      313.051,
      313.609,
      314.143,
      314.654,
      315.188,
      315.699,
      316.233,
      316.743,
      317.277,
      317.788,
      318.322,
      318.833,
      319.344,
      319.878,
      320.412,
      320.946,
      321.457,
      322.014,
      322.525,
      323.082,
      323.617,
      324.151,
      324.685,
      325.195,
      325.73,
      326.24,
      326.774,
      327.308,
      327.796,
      328.33,
      328.864,
      329.398,
      329.909,
      330.443,
      330.954,
      331.488,
      331.999,
      332.51,
      333.044,
      333.555,
      334.089,
      334.623,
      335.157,
      335.668,
      336.202,
      336.713,
      337.247,
      337.804,
      338.315,
      338.849,
      339.383,
      339.917,
      340.428,
      340.985,
      341.519,
      342.03,
      342.564,
      343.098,
      343.632,
      344.143,
      344.654,
      345.188,
      345.722,
      346.233,
      346.767,
      347.278,
      347.788,
      348.323,
      348.833,
      349.344,
      349.878,
      350.389,